{
  "schema_version": "grid-request-v2",
  "base": {
    "schema_version": "scenario-v2",
    "model_version": "barnea-parallel-bound-o2-v1",
    "indexing_basis": "per_m2",
    "flow": {
      "mode": "total_ratio",
      "qt_l_min_m2": 6,
      "r": 1
    },
    "capacity": {
      "mode": "hb_linear",
      "hb_g_dl": 9,
      "kappa_ml_o2_g_hb": 1.34
    },
    "spv_fraction": 0.98,
    "vo2_target_ml_min_m2": 150,
    "source_context": "ahmed-inspired-abstract-supported"
  },
  "criteria": {
    "schema_version": "criteria-v1",
    "id": "ahmed-abstract-70-40",
    "sa_lower_fraction": 0.7,
    "sv_lower_fraction": 0.4,
    "comparison": "strict_greater_than",
    "origin": "source_reported_abstract",
    "source_id": "P2"
  },
  "x": {
    "parameter": "capacity.hb_g_dl",
    "min": 6,
    "max": 20,
    "n": 201,
    "scale": "linear"
  },
  "y": {
    "parameter": "flow.qt_l_min_m2",
    "min": 2,
    "max": 12,
    "n": 201,
    "scale": "linear"
  },
  "metrics": [
    "sa_fraction",
    "sv_fraction"
  ]
}
